[
  {"id":"claim.architecture-description.normative","documentCanonicalId":"concept.architecture-description","statement":{"tr":"Mimari açıklama; paydaşları, kaygıları, bakış açılarını, görünümleri ve bunlar arasındaki ilişkileri izlenebilir biçimde ele alır.","en":"An architecture description addresses stakeholders, concerns, viewpoints, views, and their relationships traceably.","es":"Una descripción de arquitectura aborda de forma trazable las partes interesadas, inquietudes, puntos de vista, vistas y sus relaciones."},"confidence":"strong","status":"reviewed","evidence":[{"sourceId":"source.iso-42010","locator":"ISO/IEC/IEEE 42010:2022, Clauses 5–7","role":"supports"}]},
  {"id":"claim.local-first.ownership","documentCanonicalId":"guide.project-constitution","statement":{"tr":"Yerel öncelikli yazılım, kullanıcı verisinin birincil kopyasını kullanıcının cihazında tutmayı ve ağdan bağımsız çalışmayı hedefler.","en":"Local-first software aims to keep the primary copy of user data on the user's device and operate independently of the network.","es":"El software local-first busca mantener la copia principal de los datos en el dispositivo del usuario y funcionar sin depender de la red."},"confidence":"strong","status":"reviewed","evidence":[{"sourceId":"source.local-first-paper","locator":"Sections 1–2","role":"supports"}]},
  {"id":"claim.ai-risk.lifecycle","documentCanonicalId":"concept.ai-risk-management","statement":{"tr":"Yapay zekâ risk yönetimi tek seferlik bir kontrol değil, yaşam döngüsü boyunca sürekli yürütülen bir faaliyettir.","en":"AI risk management is not a one-time control but a continuous lifecycle activity.","es":"La gestión de riesgos de IA no es un control único, sino una actividad continua durante el ciclo de vida."},"confidence":"strong","status":"reviewed","evidence":[{"sourceId":"source.nist.ai-rmf-1","locator":"AI RMF Core","role":"supports"}]},
  {"id":"claim.rfc.lifecycle","documentCanonicalId":"concept.rfc-lifecycle","statement":{"tr":"Bir RFC başka RFC'leri güncelleyebilir veya geçersiz kılabilir; güncel teknik anlam ilişki zinciriyle değerlendirilmelidir.","en":"An RFC may update or obsolete other RFCs; current technical meaning should be evaluated through the relationship chain.","es":"Un RFC puede actualizar u dejar obsoletos otros RFC; el significado técnico actual debe evaluarse mediante la cadena de relaciones."},"confidence":"strong","status":"reviewed","evidence":[{"sourceId":"source.rfc2026","locator":"Sections 4–6","role":"supports"},{"sourceId":"source.rfc-editor","locator":"RFC metadata records","role":"qualifies"}]}
]
